,Name,Purpose
0, Reese and Sons, Business-focused modular infrastructure for revolutionize clicks-and-mortar bandwidth
1," Green, Rodriguez and Reyes", Phased asymmetric database for incentivize end-to-end initiatives
2," Evans, David and Long", Virtual reciprocal productivity for mesh transparent e-tailers
3," Wright, Bates and Alexander", Ameliorated human-resource neural-net for redefine impactful ROI
4, Davies-Mitchell, Innovative optimizing benchmark for engage magnetic communities
5," Russell, Moody and Mills", Balanced analyzing migration for implement real-time e-services
6, Perez-Fisher, Virtual stable conglomeration for unleash scalable web services
7, Miller-Miles, Managed maximized paradigm for repurpose frictionless architectures
8, Marquez-James, Enhanced upward-trending ability for grow bleeding-edge interfaces
9," Mueller, Barker and Orr", Cross-platform value-added collaboration for empower turn-key paradigms
10," Anderson, Beltran and Charles", Fundamental regional application for implement dynamic convergence
11, Taylor Inc, Cross-group empowering model for extend frictionless experiences
12, Walker Ltd, Automated transitional model for enhance web-enabled models
13, Cisneros-Sims, Sharable background infrastructure for unleash innovative synergies
14, Knapp-Martin, Secured neutral analyzer for leverage extensible vortals
15, Davis-Luna, Optimized 5thgeneration website for engage sticky e-markets
16," Pruitt, Wolfe and May", Reduced uniform time-frame for visualize cross-platform paradigms
17," Vance, Ray and Austin", Automated bandwidth-monitored success for reinvent enterprise relationships
18, Dennis-Strickland, Progressive didactic migration for synergize 24/7 communities
19," Perez, Townsend and Miller", Intuitive leadingedge solution for exploit virtual metrics
20, Heath PLC, Streamlined clear-thinking data-warehouse for innovate wireless markets
21," Vasquez, Johnson and Becker", Intuitive 24/7 circuit for enhance scalable deliverables
22, Thomas-Holland, User-centric encompassing Local Area Network for enhance out-of-the-box initiatives
23," Lang, Harrison and Gillespie", Cross-group intermediate system engine for transform cross-media portals
24, Hall LLC, Realigned multi-state access for implement wireless convergence
25, Sparks-Buchanan, Distributed incremental software for productize intuitive applications
26, Wagner-Reid, Switchable next generation pricing structure for empower end-to-end metrics
27, Jones-Nelson, Monitored empowering hierarchy for iterate sticky supply-chains
28," Moore, Rodriguez and Bass", Operative well-modulated hardware for integrate distributed solutions
29, Hubbard LLC, Up-sized attitude-oriented adapter for orchestrate efficient content
30, Oconnor-Burton, Sharable intermediate projection for utilize clicks-and-mortar methodologies
31, Weaver and Sons, Profit-focused exuding solution for unleash cross-media bandwidth
32," Thompson, Stewart and King", Customizable 4thgeneration service-desk for architect collaborative mindshare
33," Hoffman, Clark and Calderon", User-friendly stable artificial intelligence for benchmark collaborative infrastructures
34, Blackburn PLC, Realigned fault-tolerant function for aggregate turn-key ROI
35, Cox Inc, Reduced full-range complexity for exploit holistic solutions
36, Morgan Inc, Polarized coherent core for whiteboard integrated models
37, Robinson-Castillo, Streamlined multi-tasking implementation for evolve interactive mindshare
38," Lucas, Hernandez and Stokes", Extended 5thgeneration portal for orchestrate B2B platforms
39," Reynolds, Crawford and Richards", Future-proofed well-modulated framework for scale B2C platforms
40, Lewis and Sons, Reverse-engineered national parallelism for repurpose dot-com web-readiness
41, Thompson LLC, De-engineered content-based secured line for incentivize next-generation solutions
42, Wise-Lyons, Persevering 24/7 collaboration for aggregate intuitive systems
43, Zuniga PLC, Distributed 24hour capacity for synergize user-centric networks
44, Beck Inc, Down-sized multimedia flexibility for re-intermediate 24/365 models
45," Phelps, Mccarthy and Marks", Multi-tiered encompassing model for embrace value-added solutions
46, Miles Ltd, Automated encompassing neural-net for aggregate killer convergence
47, Jones-Gonzalez, Cross-group well-modulated architecture for synergize interactive content
48, Nguyen-Jenkins, Distributed intangible concept for engineer revolutionary deliverables
49, Drake-Keller, Triple-buffered transitional definition for exploit sticky action-items