,Name,Purpose
0,"Morris, Fischer and Sharp",Synchronized real-time algorithm for e-enable e-business solutions
1,Campbell Inc,Customer-focused 24/7 matrix for generate B2B e-commerce
2,Smith-Moore,Right-sized incremental instruction set for enable magnetic mindshare
3,Henderson-Thornton,Cloned dedicated encoding for iterate viral initiatives
4,Gonzalez-Coleman,Synergistic bifurcated synergy for engage proactive methodologies
5,Duran-Powell,Switchable national capability for whiteboard impactful interfaces
6,Crawford and Sons,Organic fresh-thinking secured line for incubate integrated applications
7,Garrett-Scott,Function-based dedicated synergy for incubate intuitive e-services
8,"Smith, Howell and Norris",Horizontal clear-thinking Graphic Interface for deploy extensible markets
9,Clark-Burton,Reduced high-level instruction set for streamline best-of-breed interfaces
10,"Barnes, Reed and Holt",Extended high-level intranet for disintermediate seamless models
11,Leonard-Hanson,Right-sized zero tolerance contingency for productize holistic eyeballs
12,Little PLC,Grass-roots real-time paradigm for leverage holistic info-mediaries
13,"Gonzalez, Phelps and Macias",Re-contextualized client-server definition for redefine ubiquitous systems
14,Hall Ltd,Reverse-engineered real-time adapter for revolutionize cross-platform solutions
15,Cox-Duncan,Monitored transitional approach for synthesize frictionless web services
16,"Nicholson, Torres and Mccarthy",Programmable scalable emulation for morph ubiquitous ROI
17,Chavez-Young,Profound 4thgeneration emulation for streamline best-of-breed infrastructures
18,Johnson-Smith,Cross-platform coherent core for scale e-business infrastructures
19,"Wilkerson, Jackson and Parker",Profound zero administration project for strategize real-time functionalities
20,"Powell, Garcia and Moyer",Versatile system-worthy capability for synthesize revolutionary users
21,"Webb, Ramos and Collins",Sharable global policy for seize compelling schemas
22,Hinton Ltd,Versatile client-driven structure for strategize granular schemas
23,Stevenson-Delgado,Automated discrete neural-net for synergize robust applications
24,Turner-Malone,Right-sized didactic projection for integrate seamless markets
25,"Wright, Perry and Allen",Public-key multi-tasking parallelism for brand scalable eyeballs
26,Powell-Rivera,Business-focused high-level solution for strategize mission-critical info-mediaries
27,Burns-Zavala,Synchronized tangible info-mediaries for iterate scalable communities
28,Davis and Sons,Implemented encompassing open architecture for drive frictionless users
29,"Haas, Perez and Galvan",Pre-emptive tangible interface for incubate distributed metrics
30,"Garrison, Campbell and Green",Reduced systematic solution for exploit killer synergies
31,Gardner Group,Operative asymmetric extranet for benchmark 24/7 info-mediaries
32,Randolph-Kerr,Customizable directional alliance for expedite value-added e-services
33,Owens Ltd,Versatile eco-centric throughput for utilize front-end communities
34,Johnson Group,Reverse-engineered next generation methodology for incentivize scalable technologies
35,Clark LLC,Organic national groupware for architect 24/7 architectures
36,Clark Inc,De-engineered context-sensitive customer loyalty for transition killer users
37,"Reynolds, Krause and Elliott",Quality-focused demand-driven paradigm for streamline transparent schemas
38,Hatfield PLC,Optimized holistic groupware for incubate viral mindshare
39,"Daugherty, Brewer and Washington",Persistent analyzing frame for brand real-time communities
40,Griffin-Stephens,Streamlined impactful circuit for synthesize integrated supply-chains
41,Bowen-Harmon,Decentralized tangible info-mediaries for target impactful systems
42,"Stanley, Mayo and Hartman",Open-architected analyzing Internet solution for benchmark bleeding-edge communities
43,Krueger and Sons,Progressive background hierarchy for engage bricks-and-clicks web services
44,Roy-Sanchez,Extended modular hierarchy for strategize distributed e-markets
45,Brown Ltd,Fully-configurable solution-oriented toolset for facilitate magnetic schemas
46,"Simmons, Alvarado and Herrera",Seamless background extranet for re-intermediate frictionless systems
47,Yates and Sons,Integrated value-added time-frame for envisioneer B2C applications
48,Scott-Scott,Focused bifurcated extranet for incentivize intuitive action-items
49,Hernandez-Martinez,Fundamental mobile policy for utilize plug-and-play synergies
